329,Thu Mar 09 20:55:00 +00:00 2023,a dit cotait cher,0,a4ad2eb6,,,,,,,,,,,,,,,,0,0,1,,,,,,,,,,,,,,,,,,,,,,,,,,,,,,,,,,,,,,,,,,,,,,,,,,0,#recherche,#papillomavirus,#GARDASIL,#graphene,,,,,,,,,,,,,,,,,,,,,1.633934571984101e+18,,,,,https://twitter.com/AirBoita/status/1633934571984101380,False,0d5fdd17,fr,1
332,Mon Mar 13 01:35:00 +00:00 2023,provoque lendomètriose pose cette question car connais deux femmes lendomètriose curieusement dèclenchè suite vaccin coôncidence,8,,,,,,,,,,,,,,,,,0,0,3,e5e7f4cb,,,,,,,,,,,,,,,,,,,,,,,,,,,,,,,,,,,,,,,,,,,,,,,,,2,#gardasil,,,,,,,,,,,,,,,,,,,,,,,,1.6350920967293747e+18,,,,,https://twitter.com/ILove3M/status/1635092096729374720,False,48185489,fr,13
337,Thu Mar 09 19:53:00 +00:00 2023,vaccinez ni fille ni garons gardasilun vaccin dangereux inefficace contre cancerle conseil indien recherche mèdicale a exigè larrt immèdiat aprës dècës jeunes fille moins effets secondaires indèsirables,0,,,,,,,,,,,,,,,,,0,0,0,,,,,,,,,,,,,,,,,,,,,,,,,,,,,,,,,,,,,,,,,,,,,,,,,,2,#Gardasil,,,,,,,,,,,,,,,,,,,,,,,,1.633919069886861e+18,,,,,https://twitter.com/72andree72/status/1633919069886861312,False,87d7af5f,fr,2
340,Wed Jan 18 14:31:00 +00:00 2023,nexiste aucune preuve defficacite prètendre contraire comme fait lafp factuel mensonger,0,,,,,,,,,,,,,,,,,0,0,1,,,,,,,,,,,,,,,,,,,,,,,,,,,,,,,,,,,,,,,,,,,,,,,,,,0,#ANTICANCER,#Gardasil.,,,,,,,,,,,,,,,,,,,,,,,1.6157185917388227e+18,,,,,https://twitter.com/jeremy_chevrot/status/1615718591738822659,False,a11f2d45,fr,1
344,Wed Jan 18 14:30:00 +00:00 2023,francesoirfropinionstribu,0,,,,,,,,,,,,,,,,,0,0,1,,,,,,,,,,,,,,,,,,,,,,,,,,,,,,,,,,,,,,,,,,,,,,,,,,0,"#mensonges.""""""""",,,,,,,,,,,,,,,,,,,,,,,,1.6157181613278246e+18,https://www.francesoir.fr/opinions-tribunes/gardasil-10-mensonges-dans-un-seul-article-d-afp-factuel,,,,https://twitter.com/jeremy_chevrot/status/1615718161327824896,False,a11f2d45,fr,1
345,Thu Mar 09 19:49:00 +00:00 2023,comme cervirix reactionfrdroitdepense,0,,,,,,,,,,,,,,,,,0,0,0,380239dd,,,,,,,,,,,,,,,,,,,,,,,,,,,,,,,,,,,,,,,,,,,,,,,,,0,#Gardasil,,,,,,,,,,,,,,,,,,,,,,,,1.633918004181303e+18,https://reaction19.fr/droit-de-pensee/art-dinformer/nicole-et-gerard-delepine/delepine-2023/delepine-fev-2023/100223-mensonges-du-parisien-sur-le-gardasil-dr-gerard-delepine,,,,https://twitter.com/drkronbernard/status/1633918004181303299,False,03fbc1f4,fr,0
347,Sat Mar 11 22:08:00 +00:00 2023,injection vax obligatoires nourrissons loi agnës buzyn causent effets secondaires graf effets secondaires causès adjuvantsle provoque dècës effets secondaires graf pay lont interdit,0,,,,,,,,,,,,,,,,,0,0,0,,,,,,,,,,,,,,,,,,,,,,,,,,,,,,,,,,,,,,,,,,,,,,,,,,0,#Gardasil,,,,,,,,,,,,,,,,,,,,,,,,1.6346778160620995e+18,,,,,https://twitter.com/72andree72/status/1634677816062099458,False,87d7af5f,fr,0
352,Mon Dec 19 22:48:00 +00:00 2022,comme bètailaimsiborggardas,1,,,,,,,,,,,,,,,,,0,0,0,,,,,,,,,,,,,,,,,,,,,,,,,,,,,,,,,,,,,,,,,,,,,,,,,,0,"#Gardasil,",#enfants,#Papillomavirus,,,,,,,,,,,,,,,,,,,,,,1.604971907589501e+18,https://www.aimsib.org/2022/12/18/gardasil-vos-enfants-comme-du-betail/,,,,https://twitter.com/InfoActu_9/status/1604971907589500929,False,aa5c86ac,fr,1
353,Thu Dec 29 21:06:00 +00:00 2022,arrtons,1,,,,,,,,,,,,,,,,,0,0,0,,,,,,,,,,,,,,,,,,,,,,,,,,,,,,,,,,,,,,,,,,,,,,,,,,1,#injection,#papillomavirus,#gardasil,,,,,,,,,,,,,,,,,,,,,,1.608570203574784e+18,,,,,https://twitter.com/hecanthrope/status/1608570203574784000,False,919b2d18,fr,2
356,Sun Dec 11 23:56:00 +00:00 2022,ohhh ouin ouin ouin cest partir quel ge non plus no commencez dèj faire avant vouloir tout règenter dautrui substituer rahhhhhhh,0,,,,,,,,,,,,,,,,,0,0,0,,,,,,,,,,,,,,,,,,,,,,,,,,,,,,,,,,,,,,,,,,,,,,,,,,0,#mineurs,#Gardasil,#ARNm,#enfant,#familles,#parents.,,,,,,,,,,,,,,,,,,,1.6020900355280115e+18,,,,,https://twitter.com/Liv93741514/status/1602090035528011776,True,e785b87d,fr,0
357,Fri Dec 09 17:00:00 +00:00 2022,dèj vaccin contre papillomavirus couvre peu souches plus safe,1,,,,,,,,,,,,,,,,,0,0,0,,,,,,,,,,,,,,,,,,,,,,,,,,,,,,,,,,,,,,,,,,,,,,,,,,0,#Gardasil,#SEP,#ARNm,,,,,,,,,,,,,,,,,,,,,,1.6012605077043484e+18,,,,,https://twitter.com/Liv93741514/status/1601260507704348673,True,e785b87d,fr,1
360,Sat Jan 14 17:38:00 +00:00 2023,abomination vaccin pourri quils veulent rendre obligatoire bienveillanceet scieeeeaaaaoooonce,0,,,,,,,,,,,,,,,,,0,0,0,,,,,,,,,,,,,,,,,,,,,,,,,,,,,,,,,,,,,,,,,,,,,,,,,,0,#SauvonsLesJeunes,#Pfizer,#COVID19,#vaccins,#EffetsSecondairesvaccins19,#gardasil,#Cancer,#spike,#HPVvax,#papillomavirus,#JusticePourLesSuspendus,,,,,,,,,,,,,,1.6143159947757975e+18,,,,,https://twitter.com/ChristinePadych/status/1614315994775797760,False,9d484c58,fr,0
366,Thu Mar 09 19:25:00 +00:00 2023,enfin chiffres publiès concernent baisse nombre dhpv a souches vaccins nen comportent,4,,,,,,,,,,,,,,,,,0,0,0,03fbc1f4,930d0858,,,,,,,,,,,,,,,,,,,,,,,,,,,,,,,,,,,,,,,,,,,,,,,,2,#Gardasil,,,,,,,,,,,,,,,,,,,,,,,,1.6339117937718395e+18,,,,,https://twitter.com/drkronbernard/status/1633911793771839495,False,03fbc1f4,fr,6
369,Thu Dec 29 20:39:00 +00:00 2022,pourtant question ètait dèj posèe dèj perdu examen passage yeux ceci bien avant actuels,2,,,,,,,,,,,,,,,,,0,0,0,43504360,26edaa4a,c8f7c8bf,,,,,,,,,,,,,,,,,,,,,,,,,,,,,,,,,,,,,,,,,,,,,,,1,#Gardasil,#dealers,#Pfizer,,,,,,,,,,,,,,,,,,,,,,1.6085633085246095e+18,,,,,https://twitter.com/Dalluin_Von_G/status/1608563308524609539,False,6acd78cd,fr,3
370,Mon Dec 19 22:27:00 +00:00 2022,aimsiborggardas enfants comme bètail,1,,,,,,,,,,,,,,,,,0,0,0,,,,,,,,,,,,,,,,,,,,,,,,,,,,,,,,,,,,,,,,,,,,,,,,,,0,#gardasil,,,,,,,,,,,,,,,,,,,,,,,,1.604966734569644e+18,https://www.aimsib.org/2022/12/18/gardasil-vos-enfants-comme-du-betail/,,,,https://twitter.com/panierbienetre/status/1604966734569644032,False,d645f53d,fr,1
372,Tue Jan 24 22:06:00 +00:00 2023,faites a effets secondaires grave vaccin,4,,,,,,,,,,,,,,,,,0,0,0,1e3817c6,,,,,,,,,,,,,,,,,,,,,,,,,,,,,,,,,,,,,,,,,,,,,,,,,1,#gardasil,,,,,,,,,,,,,,,,,,,,,,,,1.6180073980815278e+18,,,,,https://twitter.com/ILove3M/status/1618007398081527824,False,48185489,fr,5
373,Sun Dec 11 22:47:00 +00:00 2022,vaccinèe maladie auto immune crohn jose mme demander si a lien risque devenir folle vaccinerai plus jamais heureusement nai fait celui covid,0,,,,,,,,,,,,,,,,,0,0,0,,,,,,,,,,,,,,,,,,,,,,,,,,,,,,,,,,,,,,,,,,,,,,,,,,0,#gardasil,,,,,,,,,,,,,,,,,,,,,,,,1.6020725291364557e+18,,,,,https://twitter.com/Mathild58381224/status/1602072529136455681,False,0d540bfe,fr,0
375,Tue Mar 07 21:09:00 +00:00 2023,hop recommence aprës tout cetait juste seuls gavent grce politiques sanitairesî occidentales tour maintenantet puis si dit quil ny a deffet secondaire cest bon lhumanitè,2,,,,,,,,,,,,,,,,,0,0,0,782ad777,f0e23d43,,,,,,,,,,,,,,,,,,,,,,,,,,,,,,,,,,,,,,,,,,,,,,,,1,#pfizer,#moderna,#Merck,#Gardasil,,,,,,,,,,,,,,,,,,,,,1.633213329379414e+18,,,,,https://twitter.com/jean2florette/status/1633213329379414016,False,76a6a178,fr,3
376,Fri Dec 09 16:16:00 +00:00 2022,monsieur dèputè renseignez avant proposer tt vaccin contre obligatoire milliers fille vie dètruite vaccin inefficace bon suivi gyneco annuel suffit pr avoir mme rèsultats,1,,,,,,,,,,,,,,,,,0,0,0,d5318014,d334d4af,5b06a6e1,579838ac,7e7bee66,,,,,,,,,,,,,,,,,,,,,,,,,,,,,,,,,,,,,,,,,,,,,0,#gardasil,#papillomavirus,,,,,,,,,,,,,,,,,,,,,,,1.6012493305972204e+18,,,,,https://twitter.com/Fff1175942/status/1601249330597220352,False,c812a5b9,fr,1
377,Fri Mar 03 23:59:00 +00:00 2023,navez rien compris antivax avis dèpend dit macron libè mme raoult donnèes vaccin marche vie rèelle cest dommage ètait prometteur jy cru,39,,,,,,,,,,,,,,,,,0,0,3,d52fa009,,,,,,,,,,,,,,,,,,,,,,,,,,,,,,,,,,,,,,,,,,,,,,,,,16,#Gardasil,,,,,,,,,,,,,,,,,,,,,,,,1.6318065818000916e+18,,,,,https://twitter.com/VirusWar/status/1631806581800091651,True,c8f7c8bf,fr,58
378,Wed Mar 01 23:56:00 +00:00 2023,dècembre dr liliana zelada trouve graphëne vaccin tètravalent recombinantgardasil contre papillomavirus,1,,,,,,,,,,,,,,,,,0,0,0,,,,,,,,,,,,,,,,,,,,,,,,,,,,,,,,,,,,,,,,,,,,,,,,,,1,#gardasil,#vaccin,#graphene,,,,,,,,,,,,,,,,,,,,,,1.631081058203517e+18,,,,,https://twitter.com/Laurent0191/status/1631081058203516931,False,797bc316,fr,2
380,Sat Feb 25 23:51:00 +00:00 2023,avoir vrais conseils avisès nest absolument ni sinistre santè quil faut ècouter spècialiste mondialelien vers documentaire odyseecom,0,,,,,,,,,,,,,,,,,0,110,61,,,,,,,,,,,,,,,,,,,,,,,,,,,,,,,,,,,,,,,,,,,,,,,,,,972,#France,#Paris,#Jarnac,#charente,#Vaccin,#HPV,#Papillomavirus,#Macron,#Gardasil,,,,,,,,,,,,,,,,1.6296302808342036e+18,https://odysee.com/@laileastick:4/2022-049-Medicaments-sous-influence:2,,,,https://twitter.com/aileastick1/status/1629630280834203648,True,27e2db75,fr,1143
381,Sun Mar 05 22:41:00 +00:00 2023,bro labos deux sou,0,61dce985,e9406fca,,,,,,,,,,,,,,,0,0,0,,,,,,,,,,,,,,,,,,,,,,,,,,,,,,,,,,,,,,,,,,,,,,,,,,0,#gardasil,#stop,#touchezPasANosEnfants,#MacronDestitution,#stop,#dehors!??????,,,,,,,,,,,,,,,,,,,1.6325116299076155e+18,,,,,https://twitter.com/Aimeecesaire11/status/1632511629907615745,False,534f6aa7,fr,0
385,Sat Mar 11 18:59:00 +00:00 2023,bravo merci,3,,,,,,,,,,,,,,,,,0,0,0,0b1623f5,,,,,,,,,,,,,,,,,,,,,,,,,,,,,,,,,,,,,,,,,,,,,,,,,0,#NeTouchezPasANosEnfants,#EffetsSecondaires,#Covid,#Gardasil,,,,,,,,,,,,,,,,,,,,,1.6346301697752924e+18,,,,,https://twitter.com/JaneOfArc6/status/1634630169775292416,False,7086e2aa,fr,3
386,Wed Jan 18 08:46:00 +00:00 2023,vaccinantihpv papillomavirus mensonges seul article lafp factuelmerci dèbunker propagande francesoirfropinionstribu,409,ed522992,,,,,,,,,,,,,,,,0,2,7,,,,,,,,,,,,,,,,,,,,,,,,,,,,,,,,,,,,,,,,,,,,,,,,,,205,#Gardasil,#BigPharma,,,,,,,,,,,,,,,,,,,,,,,1.6156317331221258e+18,http://www.francesoir.fr/opinions-tribunes/gardasil-10-mensonges-dans-un-seul-article-d-afp-factuel,,,,https://twitter.com/philippeherlin/status/1615631733122125825,True,7926d0b2,fr,623
391,Thu Dec 29 15:16:00 +00:00 2022,bon contre exemple prèventif efficace nest,0,,,,,,,,,,,,,,,,,0,0,1,1ac9d8b8,e1c5772a,,,,,,,,,,,,,,,,,,,,,,,,,,,,,,,,,,,,,,,,,,,,,,,,0,#Gardasil,#ARNm,,,,,,,,,,,,,,,,,,,,,,,1.6084820282692155e+18,,,,,https://twitter.com/ichonoclast1/status/1608482028269215744,False,0427b4ac,fr,1
392,Mon Dec 19 22:16:00 +00:00 2022,oui cinc vaccins date rècents cètait dèj mme cynisme alors test dèpistage ètaient restent opèrationnels autant men souvienne sans compter traitements,2,,,,,,,,,,,,,,,,,0,0,0,32f667c9,d5aa46be,,,,,,,,,,,,,,,,,,,,,,,,,,,,,,,,,,,,,,,,,,,,,,,,0,#dealers,#Pfizer,"#Gardasil,",,,,,,,,,,,,,,,,,,,,,,1.604963806572e+18,,,,,https://twitter.com/Dalluin_Von_G/status/1604963806572003328,False,6acd78cd,fr,2
393,Tue Jan 24 20:46:00 +00:00 2023,a fait fil documentè,1,ae86383b,,,,,,,,,,,,,,,,0,0,0,12ba55ec,1e3817c6,fd900b24,,,,,,,,,,,,,,,,,,,,,,,,,,,,,,,,,,,,,,,,,,,,,,,0,#Gardasil.,,,,,,,,,,,,,,,,,,,,,,,,1.6179872470470735e+18,,,,,https://twitter.com/DLFParis16/status/1617987247047073793,False,12ba55ec,fr,1
394,Sun Dec 11 20:25:00 +00:00 2022,cette pourriture tellement prèvisible dune main offre capote lautre prèvient davance propagande outranciëre quil fait enfants vaxxiner contre papillomavirus reprendrez bien peu,12,,,,,,,,,,,,,,,,,0,0,1,6b68dd22,,,,,,,,,,,,,,,,,,,,,,,,,,,,,,,,,,,,,,,,,,,,,,,,,0,#GARDASIL,,,,,,,,,,,,,,,,,,,,,,,,1.6020367522560614e+18,,,,,https://twitter.com/BNEADAMA/status/1602036752256061441,False,e8c20c53,fr,13
396,Wed Mar 01 23:45:00 +00:00 2023,divergenceimagescomrodolp,1,,,,,,,,,,,,,,,,,0,0,0,,,,,,,,,,,,,,,,,,,,,,,,,,,,,,,,,,,,,,,,,,,,,,,,,,1,#Gardasil,#Papillomavirus,#OcÈaneBourguignon,,,,,,,,,,,,,,,,,,,,,,1.6310782067563438e+18,https://www.divergence-images.com/rodolphe-escher/reportages/oceane-bourguignon-victime-du-gardasil-RE0154/oceane-bourguignon-victime-du-gardasil-ref-RE0154013.html,,,,https://twitter.com/daniele_favari/status/1631078206756343808,False,b90dac39,fr,2
400,Mon Dec 19 21:36:00 +00:00 2022,dangereux,0,,,,,,,,,,,,,,,,,0,0,0,,,,,,,,,,,,,,,,,,,,,,,,,,,,,,,,,,,,,,,,,,,,,,,,,,0,#Gardasil,#vaccin,,,,,,,,,,,,,,,,,,,,,,,1.604953749914411e+18,,,,,https://twitter.com/Chapi_Chap0/status/1604953749914411008,False,02d36964,fr,0
402,Thu Mar 09 15:39:00 +00:00 2023,enqute visionner,0,,,,,,,,,,,,,,,,,0,0,0,,,,,,,,,,,,,,,,,,,,,,,,,,,,,,,,,,,,,,,,,,,,,,,,,,0,#gardasil,#papillomavirus,,,,,,,,,,,,,,,,,,,,,,,1.6338549959750984e+18,,,,,https://twitter.com/LouisSzabo/status/1633854995975098369,False,8f21e0ae,fr,0
405,Sun Dec 11 20:09:00 +00:00 2022,rt merck vouloir imposer sans jamais avoir prouvè quil protëge quelque,1,,,,,,,,,,,,,,,,,0,0,0,,,,,,,,,,,,,,,,,,,,,,,,,,,,,,,,,,,,,,,,,,,,,,,,,,0,#Gardasil,#Cancer,,,,,,,,,,,,,,,,,,,,,,,1.6020328205532403e+18,,,,,https://twitter.com/Blade88668821/status/1602032820553240577,False,89878b88,fr,1
408,Wed Dec 21 21:09:00 +00:00 2022,sais o peux mettre obligation vaccination,5,,,,,,,,,,,,,,,,,0,0,0,,,,,,,,,,,,,,,,,,,,,,,,,,,,,,,,,,,,,,,,,,,,,,,,,,2,#macron,#Gardasil,,,,,,,,,,,,,,,,,,,,,,,1.6056717491520387e+18,,,,,https://twitter.com/MelAnie20428661/status/1605671749152038914,False,ce441245,fr,7
409,Wed Mar 01 23:44:00 +00:00 2023,ca beaucoup disant vax mèfaits connus trës invalidants voire mortels bienfaits tjrs hypothètiques,0,24c36df2,c330fbbe,fb1e4217,,,,,,,,,,,,,,0,0,0,,,,,,,,,,,,,,,,,,,,,,,,,,,,,,,,,,,,,,,,,,,,,,,,,,0,#Gardasil,#hdpros,,,,,,,,,,,,,,,,,,,,,,,1.6310779536173955e+18,,,,,https://twitter.com/TotoBelOeil/status/1631077953617395714,False,56d3f62e,fr,0
410,Tue Mar 07 19:13:00 +00:00 2023,empoisonner stèriliser enfants quelle sociètè fait cela,7,48f07538,252b0256,9918b39e,,,,,,,,,,,,,,0,1,0,,,,,,,,,,,,,,,,,,,,,,,,,,,,,,,,,,,,,,,,,,,,,,,,,,4,#Gardasil,#corruption,#obligationvaccinale,,,,,,,,,,,,,,,,,,,,,,1.633184051824558e+18,,,,,https://twitter.com/DepCitoyennes/status/1633184051824558081,False,e24c876d,fr,12
412,Sat Feb 25 23:03:00 +00:00 2023,mme rèussi grce srement trouver prètexte vouloir vacciner aussi garons traitre contre autant dinepties,2,,,,,,,,,,,,,,,,,0,0,0,,,,,,,,,,,,,,,,,,,,,,,,,,,,,,,,,,,,,,,,,,,,,,,,,,3,#vaccination,#gardasil,#McKinsey,#PapNdiaye,#MACRONleTRAITRE,#TousUnis,,,,,,,,,,,,,,,,,,,1.6296181338194327e+18,,,,,https://twitter.com/08Estelle06D10/status/1629618133819432960,False,7dda4107,fr,5
415,Fri Dec 23 17:23:00 +00:00 2022,vaccinez ni fille ni garons dangereux inefficace contre francesoirfropinionstribu,1,,,,,,,,,,,,,,,,,0,0,0,,,,,,,,,,,,,,,,,,,,,,,,,,,,,,,,,,,,,,,,,,,,,,,,,,0,#Gardasil,#vaccin,#cancer,#FranceSoir,,,,,,,,,,,,,,,,,,,,,1.6063396866324152e+18,https://www.francesoir.fr/opinions-tribunes/ne-vaccinez-ni-filles-ni-garcons-par-gardasil-un-vaccin-dangereux-et-inefficace#.Y6Xj3IS8E7Y.twitter,,,,https://twitter.com/ValKocher/status/1606339686632415237,False,2cf354e6,fr,1
416,Sat Mar 11 15:46:00 +00:00 2023,arnaque poison,1,,,,,,,,,,,,,,,,,0,0,0,,,,,,,,,,,,,,,,,,,,,,,,,,,,,,,,,,,,,,,,,,,,,,,,,,0,#Gardasil,,,,,,,,,,,,,,,,,,,,,,,,1.6345815795560899e+18,,,,,https://twitter.com/Hell3June/status/1634581579556089857,False,f0dad914,fr,1
417,Thu Mar 09 09:47:00 +00:00 2023,vax anti covid provoque myocardites nombreux effets secondaires gravesles vaccins obligatoires nourrissons loi buzyn provoquent effets secondaires graf d dècës causès l adjuvant arrt immèdiat aprës dècës jeunes fille inde,1,,,,,,,,,,,,,,,,,0,0,0,,,,,,,,,,,,,,,,,,,,,,,,,,,,,,,,,,,,,,,,,,,,,,,,,,0,#Gardasil,,,,,,,,,,,,,,,,,,,,,,,,1.6337664911232696e+18,,,,,https://twitter.com/72andree72/status/1633766491123269632,False,87d7af5f,fr,1
419,Mon Jan 16 18:54:00 +00:00 2023,plan vaccination contre papillonnavirus èlëves ëme règion aquitaine discutè,2,c03a1570,af303d5e,d091e5c6,69cb1bb7,3f1954bf,a3825f34,e74fe1cb,f4798ace,,,,,,,,,0,2,0,,,,,,,,,,,,,,,,,,,,,,,,,,,,,,,,,,,,,,,,,,,,,,,,,,1,#Papillonavirus,#Gardasil,,,,,,,,,,,,,,,,,,,,,,,1.615059881597276e+18,,,,,https://twitter.com/JaneOfArc6/status/1615059881597276199,False,7086e2aa,fr,5
420,Tue Jan 24 14:34:00 +00:00 2023,animal sang froid sans beaucoup daffect travail lhomme a su surmonter beaucoup dèpreuves critique sans dèvier routeun homme poigne a promet,0,a48203ee,c03a1570,43504360,7503d5d6,,,,,,,,,,,,,0,0,1,e5e7f4cb,bd06181c,f66a38c8,,,,,,,,,,,,,,,,,,,,,,,,,,,,,,,,,,,,,,,,,,,,,,,0,#gardasil,,,,,,,,,,,,,,,,,,,,,,,,1.617893629007368e+18,,,,,https://twitter.com/beauntel/status/1617893629007368194,False,e5e7f4cb,fr,1
422,Mon Dec 19 21:28:00 +00:00 2022,oui cinc vaccins date rècents cètait dèj mme cynisme ivm hcq,1,,,,,,,,,,,,,,,,,0,0,0,7661d629,,,,,,,,,,,,,,,,,,,,,,,,,,,,,,,,,,,,,,,,,,,,,,,,,1,#dealers,#Pfizer,"#Gardasil,",,,,,,,,,,,,,,,,,,,,,,1.604951925698351e+18,,,,,https://twitter.com/Dalluin_Von_G/status/1604951925698351104,False,6acd78cd,fr,2
423,Tue Mar 07 17:52:00 +00:00 2023,belle connerie lexpèrience pourtant exemple reproduire aussi dangereux queux a suffit propagande,0,,,,,,,,,,,,,,,,,0,0,0,14d9dff3,,,,,,,,,,,,,,,,,,,,,,,,,,,,,,,,,,,,,,,,,,,,,,,,,1,#Pfizer,#Gardasil,#BigPharma,,,,,,,,,,,,,,,,,,,,,,1.6331637122477875e+18,,,,,https://twitter.com/jeanfremond1/status/1633163712247787526,False,4477fd5a,fr,1
425,Wed Dec 21 20:34:00 +00:00 2022,surtout vacciner enfants maôs lu aujourdhui article mentionnait poules masse contre cherchent canard gros malades,0,,,,,,,,,,,,,,,,,0,0,0,,,,,,,,,,,,,,,,,,,,,,,,,,,,,,,,,,,,,,,,,,,,,,,,,,0,#Gardasil,#vaccination,#GrippeAviaire,#MacronEstUnPsychopathe,#Macron,#WEF,#vonderLeyen,,,,,,,,,,,,,,,,,,1.6056629112877916e+18,,,,,https://twitter.com/MarcFernand6/status/1605662911287791616,False,1a5c387d,fr,0
428,Fri Dec 23 07:52:00 +00:00 2022,parent suivez conseil prèserver santè enfants faites vacciner contre papillomavirus vaccin dangereux inefficace contre cancer cf,1,cf320380,,,,,,,,,,,,,,,,0,0,0,,,,,,,,,,,,,,,,,,,,,,,,,,,,,,,,,,,,,,,,,,,,,,,,,,0,#Gardasil,,,,,,,,,,,,,,,,,,,,,,,,1.6061959343830876e+18,,,,,https://twitter.com/BastetMichle3/status/1606195934383087616,False,33892043,fr,1
434,Tue Jan 24 14:30:00 +00:00 2023,responsables santè enfants,2,,,,,,,,,,,,,,,,,0,0,0,,,,,,,,,,,,,,,,,,,,,,,,,,,,,,,,,,,,,,,,,,,,,,,,,,2,#vaccination,#gardasil,,,,,,,,,,,,,,,,,,,,,,,1.6178925452747323e+18,,,,,https://twitter.com/08Estelle06D10/status/1617892545274732546,False,7dda4107,fr,4
435,Mon Dec 19 19:08:00 +00:00 2022,vaccin doit devenir obligatoire bien plutùt laissè lapprèciation familles,1,,,,,,,,,,,,,,,,,0,0,0,,,,,,,,,,,,,,,,,,,,,,,,,,,,,,,,,,,,,,,,,,,,,,,,,,0,#Gardasil,,,,,,,,,,,,,,,,,,,,,,,,1.6049164770855035e+18,,,,,https://twitter.com/Hermangarde_B/status/1604916477085503488,False,f7c38b2a,fr,1
437,Sun Dec 11 12:44:00 +00:00 2022,voyez venir vaccination obligatoire poison contre papillomavirus toujours jouer peur faire croire cest protection donc enfant an risque davoir cancer col lutèrus bande malades,3,,,,,,,,,,,,,,,,,0,0,1,,,,,,,,,,,,,,,,,,,,,,,,,,,,,,,,,,,,,,,,,,,,,,,,,,3,#gardasil,,,,,,,,,,,,,,,,,,,,,,,,1.6019209073243914e+18,,,,,https://twitter.com/ILove3M/status/1601920907324391424,False,48185489,fr,7
438,Sun Mar 05 22:05:00 +00:00 2023,petit point gardasil partir plan gestion risques petit plus risques vaccin nitternetnatstatde,1,6b241f53,83319a80,,,,,,,,,,,,,,,0,0,0,,,,,,,,,,,,,,,,,,,,,,,,,,,,,,,,,,,,,,,,,,,,,,,,,,0,#Gardasil,,,,,,,,,,,,,,,,,,,,,,,,1.6325027206229156e+18,https://nitter.net/Nat53703058/status/1631754319488774145?s=20,,,,https://twitter.com/eleneb/status/1632502720622915584,False,a1d353a4,fr,1
439,Wed Mar 01 23:17:00 +00:00 2023,incitation contre cest politique odyseecom,0,,,,,,,,,,,,,,,,,0,0,0,,,,,,,,,,,,,,,,,,,,,,,,,,,,,,,,,,,,,,,,,,,,,,,,,,0,#vaccination,#papillomavirus,#propagande,#Macron,#Jarnac,#Gardasil,,,,,,,,,,,,,,,,,,,1.631071250427568e+18,https://odysee.com/@LigneDroiteMatinale:8/libre-info-virus:a?src=embed&t=141.639959,,,,https://twitter.com/InfoActu_9/status/1631071250427568128,False,aa5c86ac,fr,0
442,Sat Feb 25 21:37:00 +00:00 2023,partager svp,37,e74fe1cb,72afb910,5a29f7ec,39a18cd0,8927b614,f40af646,7debd22a,6b241f53,4826edc5,567b434f,380239dd,9c980ddf,6229fd75,18e319a5,a7eb75d1,cb31cf71,0,0,1,,,,,,,,,,,,,,,,,,,,,,,,,,,,,,,,,,,,,,,,,,,,,,,,,,35,#ProtegeonsNosEnfants,,,,,,,,,,,,,,,,,,,,,,,,1.6295963495146127e+18,,,,,https://twitter.com/AssociationPEC/status/1629596349514612739,False,a7587ab3,fr,73
446,Mon Jan 16 15:32:00 +00:00 2023,bonnes future oubliez celles contre monkey truc aussi doctes savant autres leurs enfants a plus rien scientifique recommandations aussi simple cela,0,,,,,,,,,,,,,,,,,0,0,1,b48bd726,109fd087,76c742ae,97f1d7d6,,,,,,,,,,,,,,,,,,,,,,,,,,,,,,,,,,,,,,,,,,,,,,0,"#gardasil,",,,,,,,,,,,,,,,,,,,,,,,,1.6150089968673096e+18,,,,,https://twitter.com/beforechrist00/status/1615008996867309569,False,0149470b,fr,1
447,Sat Jan 14 12:53:00 +00:00 2023,tiens tiensdes veniret deviennent recours silence noublierons pendant temp ment francesoirfropinionstribu,1,,,,,,,,,,,,,,,,,0,0,0,,,,,,,,,,,,,,,,,,,,,,,,,,,,,,,,,,,,,,,,,,,,,,,,,,0,#revelations,#France,#merdias,#journaleux??????,#AFP,#Gardasil???????,#mensonges,#CORRUPTION,#Manipulation,,,,,,,,,,,,,,,,1.6142442106426737e+18,https://www.francesoir.fr/opinions-tribunes/cardio-vasculaire,,,,https://twitter.com/Vally711/status/1614244210642673664,False,17aeea4b,fr,1
448,Mon Dec 19 18:58:00 +00:00 2022,cancer leffet boomerang minutesfrsante via,1,e6d05a31,,,,,,,,,,,,,,,,0,0,0,,,,,,,,,,,,,,,,,,,,,,,,,,,,,,,,,,,,,,,,,,,,,,,,,,1,"#Gardasil,",#vaccin,,,,,,,,,,,,,,,,,,,,,,,1.6049140199194296e+18,https://www.20minutes.fr/sante/802652-20111010-cancer-gardasil-vaccin-effet-boomerang,,,,https://twitter.com/SOLARisis1/status/1604914019919429650,False,de37e57a,fr,2
449,Tue Jan 24 14:02:00 +00:00 2023,jugez donc crèdible docteur gèrard dèlèpine quand parle su sujet article parait pourtant sourcè francesoirfropinionstribu,2,,,,,,,,,,,,,,,,,0,0,1,86403bd5,1e3817c6,,,,,,,,,,,,,,,,,,,,,,,,,,,,,,,,,,,,,,,,,,,,,,,,0,#Gardasil,,,,,,,,,,,,,,,,,,,,,,,,1.6178854722479183e+18,https://www.francesoir.fr/opinions-tribunes/ne-vaccinez-ni-filles-ni-garcons-par-gardasil-un-vaccin-dangereux-et-inefficace,,,,https://twitter.com/christophe_bord/status/1617885472247918594,False,4a0ee34c,fr,3
450,Fri Mar 03 22:38:00 +00:00 2023,interdit usa france depuis voulez injecter gamin expliquez,2,e9406fca,1c6b1312,e9e48586,a7587ab3,05ca72a2,303a46bd,44c7518b,,,,,,,,,,0,0,1,,,,,,,,,,,,,,,,,,,,,,,,,,,,,,,,,,,,,,,,,,,,,,,,,,1,#Nuremberg2Now,#Gardasil,,,,,,,,,,,,,,,,,,,,,,,1.6317862754548326e+18,,,,,https://twitter.com/Lamia7517/status/1631786275454832640,False,1364f82d,fr,4
453,Fri Dec 23 07:07:00 +00:00 2022,grd danger comme pr escroquerie majeure gvt corrompu rt amis pr informer,2,,,,,,,,,,,,,,,,,0,0,1,,,,,,,,,,,,,,,,,,,,,,,,,,,,,,,,,,,,,,,,,,,,,,,,,,1,#Gardasil,#Pfizer,#COVID19,#MacronNousPrendPourDesCons,#JusticePourLesSuspendus,#vaccination,#Braun,#Veran,#spike,#Arnmessager,#UE,#EffetsSecondairesvaccins19,,,,,,,,,,,,,1.6061848212223468e+18,,,,,https://twitter.com/ChristinePadych/status/1606184821222346752,False,9d484c58,fr,4
455,Fri Mar 03 22:30:00 +00:00 2023,interdit france depuis sans commentaire non,2,,,,,,,,,,,,,,,,,0,0,2,,,,,,,,,,,,,,,,,,,,,,,,,,,,,,,,,,,,,,,,,,,,,,,,,,0,#Gardasil,,,,,,,,,,,,,,,,,,,,,,,,1.6317841468370452e+18,,,,,https://twitter.com/Lamia7517/status/1631784146837045250,False,1364f82d,fr,4
457,Sat Feb 25 20:34:00 +00:00 2023,organisons laccueillir pancartes bien voyantes tract rèinformation,51,,,,,,,,,,,,,,,,,0,1,7,e74fe1cb,,,,,,,,,,,,,,,,,,,,,,,,,,,,,,,,,,,,,,,,,,,,,,,,,37,#gardasil,#ProtegeonsNosEnfants,,,,,,,,,,,,,,,,,,,,,,,1.6295807086990743e+18,,,,,https://twitter.com/AssociationPEC/status/1629580708699074563,False,a7587ab3,fr,96
458,Sun Mar 05 20:57:00 +00:00 2023,contre prètendu tout aussi criminelle autres marchande ment cest principalement fondè croyances issue propagande,0,,,,,,,,,,,,,,,,,0,0,0,,,,,,,,,,,,,,,,,,,,,,,,,,,,,,,,,,,,,,,,,,,,,,,,,,0,#vaccination,"#Gardasil,",#mÈdecine,#charlatanisme,#DocteurKnock,#ArgentRoi,,,,,,,,,,,,,,,,,,,1.632485444008e+18,,,,,https://twitter.com/RadioMoscou/status/1632485444007997440,False,97062c21,fr,0
463,Wed Mar 01 22:38:00 +00:00 2023,vaccin maintenantinstagramcomreelcpqeidonon cest possible ilselles veulent vraiment mort empoisonnent comme,0,,,,,,,,,,,,,,,,,0,0,0,,,,,,,,,,,,,,,,,,,,,,,,,,,,,,,,,,,,,,,,,,,,,,,,,,0,#GrapheneOxide,#Gardasil,#VaccineSideEffects,#EffetsSecondairesVaccins,#COVID19,#CORONAGATES,,,,,,,,,,,,,,,,,,,1.631061441871528e+18,https://www.instagram.com/reel/CpQE-i5DoZo/?igshid=YmMyMTA2M2Y=,,,,https://twitter.com/k01372297stephk/status/1631061441871527937,False,147bb36b,fr,0
464,Wed Dec 21 19:49:00 +00:00 2022,penser vaccin contre papillomavirus dr gèrard delèpine prend temp rèpondre si preniez temp lirene vaccinez ni fillesni garonsun vaccin dangereux inefficace contre cancerfrancesoirfropinionstribu,0,,,,,,,,,,,,,,,,,0,41,106,,,,,,,,,,,,,,,,,,,,,,,,,,,,,,,,,,,,,,,,,,,,,,,,,,0,#Gardasil,,,,,,,,,,,,,,,,,,,,,,,,1.6056517823354634e+18,https://www.francesoir.fr/opinions-tribunes/ne-vaccinez-ni-filles-ni-garcons-par-gardasil-un-vaccin-dangereux-et-inefficace,,,,https://twitter.com/CaudeHenrion/status/1605651782335463429,True,cf320380,fr,147
466,Mon Dec 19 13:30:00 +00:00 2022,enfants comme bètail reseauinternationalnetgard via international,1,,,,,,,,,,,,,,,,,0,0,1,,,,,,,,,,,,,,,,,,,,,,,,,,,,,,,,,,,,,,,,,,,,,,,,,,0,"#Gardasil,",,,,,,,,,,,,,,,,,,,,,,,,1.6048314300261827e+18,https://reseauinternational.net/gardasil-vos-enfants-comme-du-betail/,,,,https://twitter.com/FreeSpeech313/status/1604831430026182656,False,25824595,fr,2
467,Mon Feb 27 22:22:00 +00:00 2023,vidalfrmedicamentsgammes dose cote faut injecter dos fois cest jackpot,0,,,,,,,,,,,,,,,,,0,0,0,,,,,,,,,,,,,,,,,,,,,,,,,,,,,,,,,,,,,,,,,,,,,,,,,,1,#vaccination,#Gardasil,#Jarnac,#BigPharma,,,,,,,,,,,,,,,,,,,,,1.6303324908784435e+18,https://www.vidal.fr/medicaments/gammes/gardasil-30455.html,,,,https://twitter.com/Maren31_Uhl/status/1630332490878443521,False,5c3a8cbb,fr,1
